{
    "schema": {
      "name": "general_curriculum_mapper_phase1",
      "version": "0.1",
      "status": "development"
    },
    "book": {
      "book_id": "beehive_1_sb",
      "series": "Beehive American",
      "level": "1",
      "book_type": "Student Book",
      "edition": null,
      "publisher": "Oxford University Press",
      "source_filename": "Beehive American Student Book 1.pdf",
      "source_format": "PDF",
      "pdf_page_count": 135,
      "printed_page_start": 4,
      "printed_page_end": 135,
      "language": "English",
      "extraction_status": "in_progress",
      "verification_status": "unverified"
    },
    "batch": {
      "batch_id": "beehive_1_sb_batch_unit_08",
      "unit_id": "beehive_1_sb_u08",
      "source_section": "Unit 8: Food",
      "printed_page_start": 96,
      "printed_page_end": 107,
      "pdf_page_start": 96,
      "pdf_page_end": 107,
      "extraction_status": "complete"
    },
    "units": [
      {
        "unit_id": "beehive_1_sb_u08",
        "book_id": "beehive_1_sb",
        "unit_number": "8",
        "title": "Food",
        "theme": "Fruit, Food, Requests, Likes and Dislikes",
        "printed_page_start": 96,
        "printed_page_end": 107,
        "pdf_page_start": 96,
        "pdf_page_end": 107,
        "source_section_type": "unit",
        "notes": "Covers fruit vocabulary, counting with 'How many...?', preference grammar ('I like... / I don't like...'), food and drink nouns, polite requests ('Can I have some..., please? / Yes, here you go. / No, sorry!'), fable 'Fox and Stork' (being considerate), breakfast culture in Türkiye and Vietnam, contraction focus (don't = do not), a shopping role-play project, and review.",
        "verification_status": "unverified"
      }
    ],
    "pages": [
      {
        "page_id": "beehive_1_sb_p096",
        "book_id": "beehive_1_sb",
        "unit_id": "beehive_1_sb_u08",
        "printed_page": 96,
        "pdf_page": 96,
        "section_title": "Lesson 1 Words",
        "section_type": "vocabulary_presentation",
        "page_heading": "Words Fruit",
        "instructional": true,
        "visual_dependency": true,
        "audio_dependency": true,
        "notes": "Presents 8 core fruit items in a fruit stand market scene.",
        "verification_status": "unverified"
      },
      {
        "page_id": "beehive_1_sb_p097",
        "book_id": "beehive_1_sb",
        "unit_id": "beehive_1_sb_u08",
        "printed_page": 97,
        "pdf_page": 97,
        "section_title": "Lesson 1 Words / Functional Language",
        "section_type": "functional_language",
        "page_heading": "Functional Language How many...?",
        "instructional": true,
        "visual_dependency": true,
        "audio_dependency": true,
        "notes": "Counting and completing fruit baskets, and asking 'How many...?' with numerical answers.",
        "verification_status": "unverified"
      },
      {
        "page_id": "beehive_1_sb_p098",
        "book_id": "beehive_1_sb",
        "unit_id": "beehive_1_sb_u08",
        "printed_page": 98,
        "pdf_page": 98,
        "section_title": "Lesson 2 Grammar",
        "section_type": "grammar_presentation",
        "page_heading": "Grammar I like... I don't like...",
        "instructional": true,
        "visual_dependency": true,
        "audio_dependency": true,
        "notes": "Presents first-person preference statements: 'I like... / I don't like...'.",
        "verification_status": "unverified"
      },
      {
        "page_id": "beehive_1_sb_p099",
        "book_id": "beehive_1_sb",
        "unit_id": "beehive_1_sb_u08",
        "printed_page": 99,
        "pdf_page": 99,
        "section_title": "Lesson 2 Grammar",
        "section_type": "grammar_practice",
        "page_heading": "Grammar I like... I don't like...",
        "instructional": true,
        "visual_dependency": true,
        "audio_dependency": false,
        "notes": "Reading picture match and personalized fruit salad recipe preference writing.",
        "verification_status": "unverified"
      },
      {
        "page_id": "beehive_1_sb_p100",
        "book_id": "beehive_1_sb",
        "unit_id": "beehive_1_sb_u08",
        "printed_page": 100,
        "pdf_page": 100,
        "section_title": "Lesson 3 Words and Grammar",
        "section_type": "vocabulary_presentation",
        "page_heading": "Words Food",
        "instructional": true,
        "visual_dependency": true,
        "audio_dependency": true,
        "notes": "Introduces 6 prepared food and beverage items.",
        "verification_status": "unverified"
      },
      {
        "page_id": "beehive_1_sb_p101",
        "book_id": "beehive_1_sb",
        "unit_id": "beehive_1_sb_u08",
        "printed_page": 101,
        "pdf_page": 101,
        "section_title": "Lesson 3 Words and Grammar",
        "section_type": "grammar_and_song",
        "page_heading": "Grammar Can I have some..., please? Yes, here you go. / No, sorry!",
        "instructional": true,
        "visual_dependency": true,
        "audio_dependency": true,
        "notes": "Polite requests with 'Can I have some..., please?' and song 'The Noodles Song'.",
        "verification_status": "unverified"
      },
      {
        "page_id": "beehive_1_sb_p102",
        "book_id": "beehive_1_sb",
        "unit_id": "beehive_1_sb_u08",
        "printed_page": 102,
        "pdf_page": 102,
        "section_title": "Lesson 4 Story",
        "section_type": "story",
        "page_heading": "Story Vocabulary and grammar review",
        "instructional": true,
        "visual_dependency": true,
        "audio_dependency": true,
        "notes": "Frames 1–6 of story 'Fox and Stork'.",
        "verification_status": "unverified"
      },
      {
        "page_id": "beehive_1_sb_p103",
        "book_id": "beehive_1_sb",
        "unit_id": "beehive_1_sb_u08",
        "printed_page": 103,
        "pdf_page": 103,
        "section_title": "Lesson 4 Story",
        "section_type": "story_comprehension",
        "page_heading": "Story Comprehension and discussion",
        "instructional": true,
        "visual_dependency": true,
        "audio_dependency": true,
        "notes": "Frames 7–8, listening sequencing, and 'Think, Feel, Grow' discussion.",
        "verification_status": "unverified"
      },
      {
        "page_id": "beehive_1_sb_p104",
        "book_id": "beehive_1_sb",
        "unit_id": "beehive_1_sb_u08",
        "printed_page": 104,
        "pdf_page": 104,
        "section_title": "Lesson 5 Skills and Culture",
        "section_type": "skills_listening_speaking",
        "page_heading": "Listening and Speaking Breakfast food",
        "instructional": true,
        "visual_dependency": true,
        "audio_dependency": true,
        "notes": "Breakfast food in Türkiye and Vietnam; introduces 4 breakfast words.",
        "verification_status": "unverified"
      },
      {
        "page_id": "beehive_1_sb_p105",
        "book_id": "beehive_1_sb",
        "unit_id": "beehive_1_sb_u08",
        "printed_page": 105,
        "pdf_page": 105,
        "section_title": "Lesson 5 Skills and Culture",
        "section_type": "skills_reading_writing",
        "page_heading": "Reading and Writing A personal account",
        "instructional": true,
        "visual_dependency": true,
        "audio_dependency": true,
        "notes": "Personal account by Duong (Vietnam) and contraction writing focus ('don't = do not').",
        "verification_status": "unverified"
      },
      {
        "page_id": "beehive_1_sb_p106",
        "book_id": "beehive_1_sb",
        "unit_id": "beehive_1_sb_u08",
        "printed_page": 106,
        "pdf_page": 106,
        "section_title": "Project",
        "section_type": "project",
        "page_heading": "Project A shopping role-play",
        "instructional": true,
        "visual_dependency": true,
        "audio_dependency": true,
        "notes": "Team Up! 5: Create a market stand and conduct a shopping role-play.",
        "verification_status": "unverified"
      },
      {
        "page_id": "beehive_1_sb_p107",
        "book_id": "beehive_1_sb",
        "unit_id": "beehive_1_sb_u08",
        "printed_page": 107,
        "pdf_page": 107,
        "section_title": "Review 8",
        "section_type": "review",
        "page_heading": "Unit 8 Review",
        "instructional": true,
        "visual_dependency": true,
        "audio_dependency": false,
        "notes": "Self-testing vocabulary recall and 6 honeycomb review activities.",
        "verification_status": "unverified"
      }
    ],
    "vocabulary": [
      {
        "vocabulary_id": "beehive_1_sb_vocab_u08_0001",
        "book_id": "beehive_1_sb",
        "unit_id": "beehive_1_sb_u08",
        "page_id": "beehive_1_sb_p096",
        "term": "bananas",
        "normalized_term": "banana",
        "classification": "target",
        "source_context": "Labeled fruit stall illustration 1",
        "explicitly_listed": true,
        "notes": "Plural noun.",
        "verification_status": "unverified"
      },
      {
        "vocabulary_id": "beehive_1_sb_vocab_u08_0002",
        "book_id": "beehive_1_sb",
        "unit_id": "beehive_1_sb_u08",
        "page_id": "beehive_1_sb_p096",
        "term": "pears",
        "normalized_term": "pear",
        "classification": "target",
        "source_context": "Labeled fruit stall illustration 2",
        "explicitly_listed": true,
        "notes": "Plural noun.",
        "verification_status": "unverified"
      },
      {
        "vocabulary_id": "beehive_1_sb_vocab_u08_0003",
        "book_id": "beehive_1_sb",
        "unit_id": "beehive_1_sb_u08",
        "page_id": "beehive_1_sb_p096",
        "term": "apples",
        "normalized_term": "apple",
        "classification": "target",
        "source_context": "Labeled fruit stall illustration 3",
        "explicitly_listed": true,
        "notes": "Plural noun.",